{
  "ucts_version": "1.0.0",
  "conversion": {
    "from": "docx",
    "to": "md",
    "profile": "corpus"
  },
  "fixture": {
    "path": "../fixtures/corpus-callouts-and-figures.docx",
    "sha256": "8ae21d43d08de88f89a54e28ebb4d31db819567bc0d09e975fb823ae30b8b28f"
  },
  "expected": {
    "must_not_contain": [
      "<table",
      "</table>",
      "<figure",
      "<img ",
      "<figcaption>",
      "<colgroup>",
      "<td>",
      "<strong>",
      "\\[ \\]"
    ],
    "must_contain": [
      "> **Intuition rule**",
      "> **Recommended exercise**",
      "*Figure 1. Hydraulic operating envelope for a beer column.*",
      "- [ ] I can identify a DP knee from historian data.",
      "See [4] for the standard treatment."
    ],
    "must_match": [
      "(?m)\\A# Column Hydraulics Note$",
      "(?m)^## Diagnosing the Active Limit$",
      "(?m)^### Reading the DP knee$"
    ],
    "min_chars": 600
  },
  "config": {
    "timeout_ms": 120000,
    "sha256": "3de1fa663af854c0f5318d1c3882392569fdd1708ea273dc06cb8c13e3c5f8d8"
  },
  "metadata": {
    "description": "A Word document's shaded callout boxes, figures and escaped brackets become Markdown a corpus can hold: blockquotes, an italic caption, a task list and plain citation markers, with no HTML left and exactly one H1.",
    "tags": [
      "ucts",
      "corpus",
      "docx",
      "regression"
    ],
    "regression_of": "2026-09-27: converting us_spirits_distillation_column_study_guide.docx with pandoc alone produced 28 raw <table> blocks and 6 <figure> blocks. Word shades a single-cell table to draw a sidebar and GFM has no equivalent, so pandoc falls back to HTML, and the six <img> tags pointed at a media directory that was never extracted. Nothing failed: pandoc exited 0 and the .md looked plausible in a skim. Ingested, the chunker would have embedded the tags, and a retrieved chunk would have handed the judge angle brackets instead of the sidebar's text. The same document also arrived with no H1, because a Word title is a paragraph style rather than a heading level, so its ten sections were peer H1s with the title sitting above them as bold body text."
  }
}
